mysql> create table Employee(Emp_no int primary key,E_name varchar(50) not null,salary decimal(10,2));
Query OK, 0 rows affected (0.35 sec)

mysql> create table Department(Emp_no int primary key,dept_name varchar(50));
Query OK, 0 rows affected (0.39 sec)

mysql> insert into Employee (Emp_no, E_name, Salary) VALUES (201, 'John', 50000),(202, 'Alice', 60000),(203, 'Bob', 55000),(204, 'Charlie', 70000),(20
5, 'David', 10000);
Query OK, 5 rows affected (0.08 sec)
Records: 5  Duplicates: 0  Warnings: 0

mysql> select*from Employee;
+--------+---------+----------+
| Emp_no | E_name  | salary   |
+--------+---------+----------+
|    201 | John    | 50000.00 |
|    202 | Alice   | 60000.00 |
|    203 | Bob     | 55000.00 |
|    204 | Charlie | 70000.00 |
|    205 | David   | 10000.00 |
+--------+---------+----------+
5 rows in set (0.00 sec)

mysql> INSERT INTO department (Emp_no, Dept_name) VALUES (201, 'IT'),(202, 'HR'),(203, 'Finance'),(204, 'Marketing'),(205, 'Sales');
ERROR 1054 (42S22): Unknown column 'Emp_no' in 'field list'
mysql> INSERT INTO Department (Emp_no, Dept_name) VALUES (201, 'IT'),(202, 'HR'),(203, 'Finance'),(204, 'Marketing'),(205, 'Sales');
Query OK, 5 rows affected (0.07 sec)
Records: 5  Duplicates: 0  Warnings: 0

mysql> select*from Department;
+--------+-----------+
| Emp_no | dept_name |
+--------+-----------+
|    201 | IT        |
|    202 | HR        |
|    203 | Finance   |
|    204 | Marketing |
|    205 | Sales     |
+--------+-----------+
5 rows in set (0.00 sec)

mysql> select Employee.*,Department.dept_name from Employee inner join Department on Employee.dept_name=Department.dept_name;
ERROR 1054 (42S22): Unknown column 'Employee.dept_name' in 'on clause'
mysql> alter table Employee add dept_name varchar(30);
Query OK, 0 rows affected (0.29 sec)
Records: 0  Duplicates: 0  Warnings: 0

mysql> select*from Employee;
+--------+---------+----------+-----------+
| Emp_no | E_name  | salary   | dept_name |
+--------+---------+----------+-----------+
|    201 | John    | 50000.00 | NULL      |
|    202 | Alice   | 60000.00 | NULL      |
|    203 | Bob     | 55000.00 | NULL      |
|    204 | Charlie | 70000.00 | NULL      |
|    205 | David   | 10000.00 | NULL      |
+--------+---------+----------+-----------+
5 rows in set (0.00 sec)

mysql> update Employee set dept_name='HR' where Emp_no=201;
Query OK, 1 row affected (0.09 sec)
Rows matched: 1  Changed: 1  Warnings: 0
mysql> select*from Employee;
+--------+---------+----------+-----------+
| Emp_no | E_name  | salary   | dept_name |
+--------+---------+----------+-----------+
|    201 | John    | 50000.00 | HR        |
|    202 | Alice   | 60000.00 | NULL      |
|    203 | Bob     | 55000.00 | NULL      |
|    204 | Charlie | 70000.00 | NULL      |
|    205 | David   | 10000.00 | NULL      |
+--------+---------+----------+-----------+
5 rows in set (0.00 sec)

mysql> update Employee set dept_name='Finance' where Emp_no=202;
Query OK, 1 row affected (0.06 sec)
Rows matched: 1  Changed: 1  Warnings: 0

mysql> update Employee set dept_name='sales' where Emp_no=203;
Query OK, 1 row affected (0.07 sec)
Rows matched: 1  Changed: 1  Warnings: 0

mysql> update Employee set dept_name='purchase' where Emp_no=204;
Query OK, 1 row affected (0.09 sec)
Rows matched: 1  Changed: 1  Warnings: 0

mysql> update Employee set dept_name='Marketing' where Emp_no=205;
Query OK, 1 row affected (0.09 sec)
Rows matched: 1  Changed: 1  Warnings: 0

mysql> select*from Employee;
+--------+---------+----------+-----------+
| Emp_no | E_name  | salary   | dept_name |
+--------+---------+----------+-----------+
|    201 | John    | 50000.00 | HR        |
|    202 | Alice   | 60000.00 | Finance   |
|    203 | Bob     | 55000.00 | sales     |
|    204 | Charlie | 70000.00 | purchase  |
|    205 | David   | 10000.00 | Marketing |
+--------+---------+----------+-----------+
5 rows in set (0.00 sec)
mysql> select * from Employee inner join Department on Employee.dept_name=Department.dept_name;
+--------+--------+----------+-----------+--------+-----------+
| Emp_no | E_name | salary   | dept_name | Emp_no | dept_name |
+--------+--------+----------+-----------+--------+-----------+
|    201 | John   | 50000.00 | HR        |    202 | HR        |
|    202 | Alice  | 60000.00 | Finance   |    203 | Finance   |
|    205 | David  | 10000.00 | Marketing |    204 | Marketing |
|    203 | Bob    | 55000.00 | sales     |    205 | Sales     |
+--------+--------+----------+-----------+--------+-----------+
4 rows in set (0.00 sec)
mysql> select * from Employee left join Department on Employee.dept_name=Department.dept_name;
+--------+---------+----------+-----------+--------+-----------+
| Emp_no | E_name  | salary   | dept_name | Emp_no | dept_name |
+--------+---------+----------+-----------+--------+-----------+
|    201 | John    | 50000.00 | HR        |    202 | HR        |
|    202 | Alice   | 60000.00 | Finance   |    203 | Finance   |
|    203 | Bob     | 55000.00 | sales     |    205 | Sales     |
|    204 | Charlie | 70000.00 | purchase  |   NULL | NULL      |
|    205 | David   | 10000.00 | Marketing |    204 | Marketing |
+--------+---------+----------+-----------+--------+-----------+
5 rows in set (0.00 sec)
mysql> select * from Employee right join Department on Employee.dept_name=Department.dept_name;
+--------+--------+----------+-----------+--------+-----------+
| Emp_no | E_name | salary   | dept_name | Emp_no | dept_name |
+--------+--------+----------+-----------+--------+-----------+
|   NULL | NULL   |     NULL | NULL      |    201 | IT        |
|    201 | John   | 50000.00 | HR        |    202 | HR        |
|    202 | Alice  | 60000.00 | Finance   |    203 | Finance   |
|    205 | David  | 10000.00 | Marketing |    204 | Marketing |
|    203 | Bob    | 55000.00 | sales     |    205 | Sales     |
+--------+--------+----------+-----------+--------+-----------+
5 rows in set (0.00 sec)

mysql> select*from Employee where salary>(select avg(salary)from Employee);
+--------+---------+----------+-----------+
| Emp_no | E_name  | salary   | dept_name |
+--------+---------+----------+-----------+
|    201 | John    | 50000.00 | HR        |
|    202 | Alice   | 60000.00 | Finance   |
|    203 | Bob     | 55000.00 | sales     |
|    204 | Charlie | 70000.00 | purchase  |
+--------+---------+----------+-----------+
4 rows in set (0.02 sec)
